{
  "$schema": "http://json-schema.org/draft-07/schema#",
  "$id": "https://mparser.dev/schema/machine-result-v1.json",
  "title": "MParser machine result protocol major-1 consumer profile",
  "description": "Tolerant major-1 consumer schema. Historical producer shapes are frozen by protocol snapshots while the current golden fixture covers additive host-integration fields.",
  "type": "object",
  "required": [
    "protocol",
    "engine",
    "status",
    "entry_function",
    "requested_output_count",
    "outputs",
    "workspace",
    "diagnostics",
    "execution"
  ],
  "properties": {
    "protocol": {
      "type": "object",
      "required": ["name", "major", "minor"],
      "properties": {
        "name": {"const": "mparser.result"},
        "major": {"const": 1},
        "minor": {"type": "integer", "minimum": 0}
      },
      "additionalProperties": true
    },
    "engine": {
      "type": "object",
      "required": ["name", "version"],
      "properties": {
        "name": {"const": "MParser"},
        "version": {"type": "string"}
      },
      "additionalProperties": true
    },
    "status": {
      "enum": [
        "succeeded",
        "compilation-failed",
        "request-rejected",
        "runtime-failed"
      ]
    },
    "entry_function": {"type": "string"},
    "requested_output_count": {"$ref": "#/definitions/uint64"},
    "outputs": {
      "type": "array",
      "items": {
        "type": "object",
        "required": ["name", "value"],
        "properties": {
          "name": {"type": ["string", "null"]},
          "value": {"$ref": "#/definitions/runtimeValue"}
        },
        "additionalProperties": true
      }
    },
    "output_events": {
      "type": "array",
      "items": {"$ref": "#/definitions/outputEvent"}
    },
    "top_level_expressions": {
      "type": "array",
      "items": {"$ref": "#/definitions/topLevelExpression"}
    },
    "workspace": {
      "type": "array",
      "items": {
        "type": "object",
        "required": ["name", "value"],
        "properties": {
          "name": {"type": "string"},
          "value": {"$ref": "#/definitions/runtimeValue"}
        },
        "additionalProperties": true
      }
    },
    "diagnostics": {
      "type": "array",
      "items": {"$ref": "#/definitions/diagnostic"}
    },
    "execution": {"$ref": "#/definitions/execution"}
  },
  "additionalProperties": true,
  "definitions": {
    "uint64": {
      "type": "integer",
      "x-mparser-minimum": "0",
      "x-mparser-maximum": "18446744073709551615",
      "description": "Unsigned 64-bit integer. Exact bounds are represented as decimal extensions and enforced by the protocol semantic validator because common Draft-7 validators use signed numeric limits."
    },
    "dimensions": {
      "type": "array",
      "minItems": 2,
      "items": {"$ref": "#/definitions/uint64"}
    },
    "floatingNumericData": {
      "type": "array",
      "items": {
        "oneOf": [
          {"type": "number"},
          {"enum": ["NaN", "Infinity", "-Infinity"]}
        ]
      }
    },
    "integerNumericData": {
      "type": "array",
      "items": {"type": "integer"}
    },
    "logicalNumericData": {
      "type": "array",
      "items": {"type": "boolean"}
    },
    "runtimeValue": {
      "oneOf": [
        {
          "type": "object",
          "required": ["kind"],
          "properties": {
            "kind": {"const": "missing"},
            "dimensions": {"$ref": "#/definitions/dimensions"}
          },
          "additionalProperties": true
        },
        {
          "type": "object",
          "required": ["kind", "class", "dimensions", "data"],
          "properties": {
            "kind": {"const": "numeric"},
            "class": {
              "enum": [
                "double", "single", "int8", "uint8", "int16",
                "uint16", "int32", "uint32", "int64", "uint64",
                "logical"
              ]
            },
            "dimensions": {"$ref": "#/definitions/dimensions"},
            "data": {"type": "array"},
            "complex": {"const": true},
            "imaginary_data": {"type": "array"}
          },
          "dependencies": {
            "complex": ["imaginary_data"],
            "imaginary_data": ["complex"]
          },
          "oneOf": [
            {
              "properties": {
                "class": {"enum": ["double", "single"]},
                "data": {"$ref": "#/definitions/floatingNumericData"},
                "imaginary_data": {
                  "$ref": "#/definitions/floatingNumericData"
                }
              }
            },
            {
              "properties": {
                "class": {
                  "enum": [
                    "int8", "uint8", "int16", "uint16", "int32",
                    "uint32", "int64", "uint64"
                  ]
                },
                "data": {"$ref": "#/definitions/integerNumericData"},
                "imaginary_data": {
                  "$ref": "#/definitions/integerNumericData"
                }
              }
            },
            {
              "properties": {
                "class": {"const": "logical"},
                "data": {"$ref": "#/definitions/logicalNumericData"}
              },
              "not": {
                "anyOf": [
                  {"required": ["complex"]},
                  {"required": ["imaginary_data"]}
                ]
              }
            }
          ],
          "additionalProperties": true
        },
        {
          "type": "object",
          "required": ["kind", "dimensions", "utf16"],
          "properties": {
            "kind": {"const": "character"},
            "dimensions": {"$ref": "#/definitions/dimensions"},
            "utf16": {
              "type": "array",
              "items": {
                "type": "integer",
                "minimum": 0,
                "maximum": 65535
              }
            }
          },
          "additionalProperties": true
        },
        {
          "type": "object",
          "required": ["kind", "dimensions", "data"],
          "properties": {
            "kind": {"const": "string"},
            "dimensions": {"$ref": "#/definitions/dimensions"},
            "data": {
              "type": "array",
              "items": {"type": ["string", "null"]}
            }
          },
          "additionalProperties": true
        },
        {
          "type": "object",
          "required": ["kind", "dimensions", "data"],
          "properties": {
            "kind": {"const": "cell"},
            "dimensions": {"$ref": "#/definitions/dimensions"},
            "data": {
              "type": "array",
              "items": {"$ref": "#/definitions/runtimeValue"}
            }
          },
          "additionalProperties": true
        },
        {
          "type": "object",
          "required": ["kind", "dimensions", "fields", "data"],
          "properties": {
            "kind": {"const": "struct"},
            "dimensions": {"$ref": "#/definitions/dimensions"},
            "fields": {
              "type": "array",
              "items": {"type": "string"}
            },
            "data": {
              "type": "array",
              "items": {
                "type": "object",
                "additionalProperties": {
                  "$ref": "#/definitions/runtimeValue"
                }
              }
            }
          },
          "additionalProperties": true
        },
        {
          "type": "object",
          "required": [
            "kind",
            "class",
            "dimensions",
            "handle",
            "representation"
          ],
          "properties": {
            "kind": {"const": "object"},
            "class": {"type": "string"},
            "dimensions": {"$ref": "#/definitions/dimensions"},
            "handle": {"type": "boolean"},
            "enumeration_member": {"type": ["string", "null"]},
            "representation": {"const": "opaque"}
          },
          "additionalProperties": true
        },
        {
          "type": "object",
          "required": [
            "kind",
            "dimensions",
            "handle_kind",
            "backend",
            "display",
            "target_name",
            "module_bound"
          ],
          "properties": {
            "kind": {"const": "function-handle"},
            "dimensions": {"$ref": "#/definitions/dimensions"},
            "handle_kind": {"type": "string"},
            "backend": {"type": "string"},
            "display": {"type": "string"},
            "target_name": {"type": "string"},
            "class_name": {"type": ["string", "null"]},
            "method_name": {"type": ["string", "null"]},
            "declaring_class": {"type": ["string", "null"]},
            "module_bound": {"type": "boolean"}
          },
          "additionalProperties": true
        },
        {
          "type": "object",
          "required": ["kind", "dimensions", "data"],
          "properties": {
            "kind": {"const": "comma-separated-list"},
            "dimensions": {"$ref": "#/definitions/dimensions"},
            "data": {
              "type": "array",
              "items": {"$ref": "#/definitions/runtimeValue"}
            }
          },
          "additionalProperties": true
        },
        {
          "type": "object",
          "required": ["kind", "name", "value"],
          "properties": {
            "kind": {"const": "name-value-argument"},
            "name": {"type": "string"},
            "value": {"$ref": "#/definitions/runtimeValue"}
          },
          "additionalProperties": true
        }
      ]
    },
    "position": {
      "type": "object",
      "required": ["offset", "line", "column"],
      "properties": {
        "offset": {"$ref": "#/definitions/uint64"},
        "line": {"type": "integer"},
        "column": {"type": "integer"}
      },
      "additionalProperties": true
    },
    "sourceRange": {
      "oneOf": [
        {"type": "null"},
        {
          "type": "object",
          "required": ["name", "begin", "end"],
          "properties": {
            "name": {"type": "string"},
            "begin": {"$ref": "#/definitions/position"},
            "end": {"$ref": "#/definitions/position"}
          },
          "additionalProperties": true
        }
      ]
    },
    "outputEvent": {
      "type": "object",
      "required": ["sequence", "kind", "text", "source"],
      "properties": {
        "sequence": {"$ref": "#/definitions/uint64"},
        "kind": {"enum": ["display", "stdout"]},
        "text": {"type": "string"},
        "source": {"$ref": "#/definitions/sourceRange"}
      },
      "additionalProperties": true
    },
    "topLevelExpression": {
      "type": "object",
      "required": ["sequence", "output_suppressed", "source", "value"],
      "properties": {
        "sequence": {"$ref": "#/definitions/uint64"},
        "output_suppressed": {"type": "boolean"},
        "source": {"$ref": "#/definitions/sourceRange"},
        "value": {"$ref": "#/definitions/runtimeValue"}
      },
      "additionalProperties": true
    },
    "diagnostic": {
      "type": "object",
      "required": [
        "phase",
        "severity",
        "identifier",
        "message",
        "source",
        "stack",
        "causes"
      ],
      "properties": {
        "phase": {
          "enum": ["compilation", "validation", "execution"]
        },
        "severity": {"enum": ["error", "warning"]},
        "identifier": {"type": "string"},
        "message": {"type": "string"},
        "source": {"$ref": "#/definitions/sourceRange"},
        "stack": {
          "type": "array",
          "items": {
            "type": "object",
            "required": ["source", "function", "line"],
            "properties": {
              "source": {"type": "string"},
              "function": {"type": "string"},
              "line": {"type": "integer"}
            },
            "additionalProperties": true
          }
        },
        "causes": {
          "type": "array",
          "items": {"$ref": "#/definitions/cause"}
        }
      },
      "additionalProperties": true
    },
    "cause": {
      "type": "object",
      "required": ["identifier", "message", "stack", "causes"],
      "properties": {
        "identifier": {"type": "string"},
        "message": {"type": "string"},
        "stack": {
          "type": "array",
          "items": {
            "type": "object",
            "required": ["source", "function", "line"],
            "properties": {
              "source": {"type": "string"},
              "function": {"type": "string"},
              "line": {"type": "integer"}
            },
            "additionalProperties": true
          }
        },
        "causes": {
          "type": "array",
          "items": {"$ref": "#/definitions/cause"}
        }
      },
      "additionalProperties": true
    },
    "execution": {
      "type": "object",
      "required": [
        "requested_backend",
        "effective_tier",
        "profiling_collected",
        "fallback_occurred",
        "resource_controls_active",
        "optimized_execution_suppressed",
        "stop_reason",
        "executed_instruction_count",
        "typed_region_count",
        "typed_region_attempt_count",
        "typed_region_execution_count",
        "typed_region_fallback_count",
        "native_compilation_count",
        "native_cache_hit_count",
        "maximum_call_depth",
        "maximum_array_bytes",
        "maximum_diagnostic_count",
        "elapsed_nanoseconds"
      ],
      "properties": {
        "requested_backend": {
          "enum": ["automatic", "bytecode", "portable", "native"]
        },
        "effective_tier": {
          "enum": ["bytecode", "portable", "native", "mixed"]
        },
        "profiling_collected": {"type": "boolean"},
        "fallback_occurred": {"type": "boolean"},
        "resource_controls_active": {"type": "boolean"},
        "optimized_execution_suppressed": {"type": "boolean"},
        "stop_reason": {
          "enum": [
            "none",
            "cancelled",
            "instruction-limit",
            "wall-time-limit",
            "call-depth-limit",
            "array-byte-limit",
            "diagnostic-limit"
          ]
        },
        "executed_instruction_count": {"$ref": "#/definitions/uint64"},
        "typed_region_count": {"$ref": "#/definitions/uint64"},
        "typed_region_attempt_count": {"$ref": "#/definitions/uint64"},
        "typed_region_execution_count": {"$ref": "#/definitions/uint64"},
        "typed_region_fallback_count": {"$ref": "#/definitions/uint64"},
        "native_compilation_count": {"$ref": "#/definitions/uint64"},
        "native_cache_hit_count": {"$ref": "#/definitions/uint64"},
        "maximum_call_depth": {"$ref": "#/definitions/uint64"},
        "maximum_array_bytes": {"$ref": "#/definitions/uint64"},
        "maximum_diagnostic_count": {"$ref": "#/definitions/uint64"},
        "elapsed_nanoseconds": {"$ref": "#/definitions/uint64"}
      },
      "additionalProperties": true
    }
  }
}
