{"protocol":{"name":"mparser.result","major":1,"minor":2},"engine":{"name":"MParser","version":"0.86.0-test"},"status":"runtime-failed","entry_function":"entry\n\"quoted\"","requested_output_count":2,"outputs":[{"name":"primary","value":{"kind":"numeric","class":"double","dimensions":[1,1],"data":[3.5]}},{"name":null,"value":{"kind":"missing"}}],"output_events":[{"sequence":4,"kind":"display","text":"hello\n","source":{"name":"console_demo.m","begin":{"offset":10,"line":2,"column":1},"end":{"offset":18,"line":2,"column":9}}},{"sequence":6,"kind":"stdout","text":"value=42\n","source":{"name":"console_demo.m","begin":{"offset":10,"line":2,"column":1},"end":{"offset":18,"line":2,"column":9}}}],"top_level_expressions":[{"sequence":5,"output_suppressed":false,"source":{"name":"console_demo.m","begin":{"offset":10,"line":2,"column":1},"end":{"offset":18,"line":2,"column":9}},"value":{"kind":"numeric","class":"double","dimensions":[1,1],"data":[42]}},{"sequence":7,"output_suppressed":true,"source":{"name":"console_demo.m","begin":{"offset":10,"line":2,"column":1},"end":{"offset":18,"line":2,"column":9}},"value":{"kind":"numeric","class":"double","dimensions":[1,1],"data":[43]}}],"workspace":[{"name":"matrix","value":{"kind":"numeric","class":"double","dimensions":[2,2],"data":[1,3,2,4]}},{"name":"logical","value":{"kind":"numeric","class":"logical","dimensions":[2,2],"data":[false,true,true,false]}},{"name":"nonfinite","value":{"kind":"numeric","class":"double","dimensions":[1,4],"data":["NaN","Infinity","-Infinity",-0]}},{"name":"complex_single","value":{"kind":"numeric","class":"single","dimensions":[1,2],"data":[1,3],"complex":true,"imaginary_data":[2,-4]}},{"name":"uint64_exact","value":{"kind":"numeric","class":"uint64","dimensions":[1,2],"data":[9007199254740993,18446744073709551615]}},{"name":"character","value":{"kind":"character","dimensions":[2,2],"utf16":[65,67,66,68]}},{"name":"string","value":{"kind":"string","dimensions":[2,2],"data":["one","三",null,"four"]}},{"name":"cell","value":{"kind":"cell","dimensions":[2,2],"data":[{"kind":"numeric","class":"double","dimensions":[1,1],"data":[1]},{"kind":"numeric","class":"double","dimensions":[1,1],"data":[3]},{"kind":"numeric","class":"double","dimensions":[1,1],"data":[2]},{"kind":"numeric","class":"double","dimensions":[1,1],"data":[4]}]}},{"name":"structure","value":{"kind":"struct","dimensions":[2,2],"fields":["z","a"],"data":[{"z":{"kind":"numeric","class":"double","dimensions":[1,1],"data":[10]},"a":{"kind":"string","dimensions":[1,1],"data":["item-0"]}},{"z":{"kind":"numeric","class":"double","dimensions":[1,1],"data":[12]},"a":{"kind":"string","dimensions":[1,1],"data":["item-2"]}},{"z":{"kind":"numeric","class":"double","dimensions":[1,1],"data":[11]},"a":{"kind":"string","dimensions":[1,1],"data":["item-1"]}},{"z":{"kind":"numeric","class":"double","dimensions":[1,1],"data":[13]},"a":{"kind":"string","dimensions":[1,1],"data":["item-3"]}}]}},{"name":"function","value":{"kind":"function-handle","dimensions":[1,1],"handle_kind":"method","backend":"bytecode","display":"@DemoObject.scale","target_name":"scale","class_name":"DemoObject","method_name":"scale","declaring_class":"BaseObject","module_bound":true}},{"name":"object","value":{"kind":"object","class":"DemoObject","dimensions":[1,1],"handle":false,"enumeration_member":"Ready","representation":"opaque"}},{"name":"comma","value":{"kind":"comma-separated-list","dimensions":[1,2],"data":[{"kind":"numeric","class":"double","dimensions":[1,1],"data":[7]},{"kind":"string","dimensions":[1,1],"data":["eight"]}]}},{"name":"name_value","value":{"kind":"name-value-argument","name":"Scale","value":{"kind":"numeric","class":"double","dimensions":[1,1],"data":[4]}}},{"name":"bad\ufffd","value":{"kind":"numeric","class":"double","dimensions":[1,1],"data":[5]}}],"diagnostics":[{"phase":"execution","severity":"error","identifier":"MParserTest:Failure","message":"bad \"value\"\nnext\tline","source":{"name":"demo\".m","begin":{"offset":12,"line":2,"column":3},"end":{"offset":18,"line":2,"column":9}},"stack":[{"source":"demo.m","function":"entry","line":2}],"causes":[{"identifier":"MParserTest:Cause","message":"cause","stack":[{"source":"helper.m","function":"helper","line":7}],"causes":[{"identifier":"MParserTest:Nested","message":"nested","stack":[],"causes":[]}]}]},{"phase":"validation","severity":"warning","identifier":"MParserTest:Warning","message":"warning","source":null,"stack":[],"causes":[]}],"execution":{"requested_backend":"native","effective_tier":"mixed","profiling_collected":true,"fallback_occurred":true,"resource_controls_active":true,"optimized_execution_suppressed":true,"stop_reason":"wall-time-limit","executed_instruction_count":18446744073709551615,"typed_region_count":2,"typed_region_attempt_count":3,"typed_region_execution_count":4,"typed_region_fallback_count":5,"native_compilation_count":6,"native_cache_hit_count":7,"maximum_call_depth":8,"maximum_array_bytes":9,"maximum_diagnostic_count":10,"elapsed_nanoseconds":11}}
