{"protocol":{"name":"mparser.result","major":1,"minor":0},"engine":{"name":"MParser","version":"unknown"},"status":"request-rejected","entry_function":"","requested_output_count":0,"outputs":[],"workspace":[],"diagnostics":[{"phase":"validation","severity":"error","identifier":"MParser:ProtocolFailure","message":"host failure while producing machine result","source":null,"stack":[],"causes":[]}],"execution":{"requested_backend":"automatic","effective_tier":"bytecode","profiling_collected":false,"fallback_occurred":false,"resource_controls_active":false,"optimized_execution_suppressed":false,"stop_reason":"none","executed_instruction_count":0,"typed_region_count":0,"typed_region_attempt_count":0,"typed_region_execution_count":0,"typed_region_fallback_count":0,"native_compilation_count":0,"native_cache_hit_count":0,"maximum_call_depth":0,"maximum_array_bytes":0,"maximum_diagnostic_count":0,"elapsed_nanoseconds":0}}
